{
 "seed": "change_matrix_map",
 "schema_version": 1,
 "matrix_version": "1.1.1",
 "policy": {
  "max_free_groups_per_object": 5,
  "hedge_min_runner_up_p": 0.1,
  "hedge_budget_share_of_critical": 0.2
 },
 "free_search": {
  "criticality_string": "Существенное (предписание) — требует утверждения",
  "protocol_status": "WARNING",
  "criticality_level": "SUBSTANTIAL_ORDER"
 },
 "counts": {
  "families": 93,
  "routes": 167,
  "emitting_routes": 143,
  "free_routes": 11,
  "by_mapping_status": {
   "MATRIX_GAP_CONFIRMED": 11,
   "NONE": 9,
   "PROVISIONAL_DOMAIN_MAPPING": 16,
   "SOURCE_MATRIX": 131
  },
  "by_basis": {
   "ANALOGY": 22,
   "CONTEXT": 19,
   "GOLD": 4,
   "MATRIX": 116,
   "USER": 6
  }
 },
 "sources": [
  {
   "path": "packages/contracts/seed/src/change_matrix_map.yaml",
   "sha256": "01c49d1972ffed8ed9af76ca2e86f13388325b9b58aaff4c2cbd448f757913d8"
  },
  {
   "path": "packages/contracts/seed/src/free_topics.yaml",
   "sha256": "63657ccfdb99e5b33e063e6f8682143f2d6b76b2c217ec8a60bb937c60f90390"
  }
 ],
 "element_families": [
  {
   "family": "VENT_SUPPLY_UNIT",
   "label_ru": "Приточные установки общеобменной вентиляции",
   "section": "ИОС4",
   "disciplines": [
    "ОВ"
   ],
   "topic": "VENTILATION",
   "tag_patterns": [
    "^П\\d{1,2}(?:\\.\\d{1,2})?$"
   ],
   "anchors": [
    "приточная установка",
    "вентагрегат",
    "венткамера",
    "приточная система"
   ],
   "routes": [
    {
     "discrepancy_types": [
      "CONFIGURATION_CHANGED",
      "FUNCTION_CHANGED"
     ],
     "comparison_result": "CONFIGURATION_MISMATCH",
     "parameter_code": "IOS4-079",
     "parameter_mapping_status": "PROVISIONAL_DOMAIN_MAPPING",
     "emit": true,
     "sub_check": "IOS4-079.b",
     "hedge_codes": [
      "IOS4-078"
     ],
     "basis": "GOLD:G-TR-001",
     "reason": null,
     "value_templates": {
      "pd": "Конфигурация приточных установок по листу {pd_sheet} ПД",
      "rd": "Иная конфигурация на плане {rd_plan_mark}, помещение {location}",
      "id": null
     }
    },
    {
     "discrepancy_types": [
      "ELEMENT_MISSING"
     ],
     "comparison_result": "MISSING_DESIGN_ELEMENT",
     "parameter_code": "IOS4-079",
     "parameter_mapping_status": "PROVISIONAL_DOMAIN_MAPPING",
     "emit": true,
     "sub_check": "IOS4-079.b",
     "hedge_codes": [
      "IOS4-078"
     ],
     "basis": "ANALOGY",
     "reason": null,
     "value_templates": {
      "pd": "Приточная установка предусмотрена",
      "rd": "Приточная установка отсутствует",
      "id": null
     }
    },
    {
     "discrepancy_types": [
      "VALUE_DECREASED"
     ],
     "comparison_result": "VALUE_MISMATCH",
     "parameter_code": "IOS4-079",
     "parameter_mapping_status": "SOURCE_MATRIX",
     "emit": true,
     "sub_check": "IOS4-079.a",
     "hedge_codes": [],
     "basis": "MATRIX",
     "reason": null,
     "value_templates": {
      "pd": "{pd_value}",
      "rd": "{rd_value}",
      "id": "{id_value}"
     }
    },
    {
     "discrepancy_types": [
      "VALUE_INCREASED"
     ],
     "comparison_result": "VALUE_MISMATCH",
     "parameter_code": "IOS4-079",
     "parameter_mapping_status": "SOURCE_MATRIX",
     "emit": false,
     "sub_check": null,
     "hedge_codes": [],
     "basis": "CONTEXT",
     "reason": "направленный триггер «подмена на аналоги с меньшей кратностью»; рост производительности не нарушение",
     "value_templates": null
    },
    {
     "discrepancy_types": [
      "ELEMENT_ADDED"
     ],
     "comparison_result": "EXTRA_ELEMENT",
     "parameter_code": null,
     "parameter_mapping_status": null,
     "emit": false,
     "sub_check": null,
     "hedge_codes": [],
     "basis": "CONTEXT",
     "reason": "добавления — контекст, не нарушение (97 §2.10)",
     "value_templates": null
    }
   ]
  },
  {
   "family": "VENT_EXHAUST_UNIT",
   "label_ru": "Вытяжные установки и вентиляторы общеобменной вентиляции",
   "section": "ИОС4",
   "disciplines": [
    "ОВ"
   ],
   "topic": "VENTILATION",
   "tag_patterns": [
    "^В[ЕД]?\\d{1,2}(?:\\.\\d{1,2})?$"
   ],
   "anchors": [
    "вытяжная установка",
    "вытяжной вентилятор",
    "крышный вентилятор"
   ],
   "routes": [
    {
     "discrepancy_types": [
      "CONFIGURATION_CHANGED",
      "FUNCTION_CHANGED"
     ],
     "comparison_result": "CONFIGURATION_MISMATCH",
     "parameter_code": "IOS4-079",
     "parameter_mapping_status": "PROVISIONAL_DOMAIN_MAPPING",
     "emit": true,
     "sub_check": "IOS4-079.b",
     "hedge_codes": [
      "IOS4-078"
     ],
     "basis": "ANALOGY",
     "reason": null,
     "value_templates": {
      "pd": "Конфигурация вытяжных установок по листу {pd_sheet} ПД",
      "rd": "Иная конфигурация на плане {rd_plan_mark}, помещение {location}",
      "id": null
     }
    },
    {
     "discrepancy_types": [
      "VALUE_DECREASED"
     ],
     "comparison_result": "VALUE_MISMATCH",
     "parameter_code": "IOS4-079",
     "parameter_mapping_status": "SOURCE_MATRIX",
     "emit": true,
     "sub_check": "IOS4-079.a",
     "hedge_codes": [],
     "basis": "MATRIX",
     "reason": null,
     "value_templates": {
      "pd": "{pd_value}",
      "rd": "{rd_value}",
      "id": "{id_value}"
     }
    },
    {
     "discrepancy_types": [
      "ELEMENT_ADDED"
     ],
     "comparison_result": "EXTRA_ELEMENT",
     "parameter_code": null,
     "parameter_mapping_status": null,
     "emit": false,
     "sub_check": null,
     "hedge_codes": [],
     "basis": "CONTEXT",
     "reason": "добавления — контекст, не нарушение (97 §2.10)",
     "value_templates": null
    }
   ]
  },
  {
   "family": "VENT_EXHAUST_BRANCH",
   "label_ru": "Вытяжная вентиляция помещений (ветви, местные отсосы)",
   "section": "ИОС4",
   "disciplines": [
    "ОВ"
   ],
   "topic": "VENTILATION",
   "tag_patterns": [
    "^В\\d{1,2}\\.\\d{1,2}$"
   ],
   "anchors": [
    "вытяжная вентиляция",
    "местный отсос",
    "вытяжная ветвь",
    "«М.О.»"
   ],
   "routes": [
    {
     "discrepancy_types": [
      "ELEMENT_MISSING"
     ],
     "comparison_result": "MISSING_DESIGN_ELEMENT",
     "parameter_code": "IOS4-078",
     "parameter_mapping_status": "PROVISIONAL_DOMAIN_MAPPING",
     "emit": true,
     "sub_check": "IOS4-078.b",
     "hedge_codes": [
      "IOS4-079"
     ],
     "basis": "GOLD:G-TR-003",
     "reason": null,
     "value_templates": {
      "pd": "Вытяжная вентиляция предусмотрена",
      "rd": "Вытяжная вентиляция отсутствует",
      "id": null
     }
    },
    {
     "discrepancy_types": [
      "CONFIGURATION_CHANGED"
     ],
     "comparison_result": "CONFIGURATION_MISMATCH",
     "parameter_code": "IOS4-078",
     "parameter_mapping_status": "PROVISIONAL_DOMAIN_MAPPING",
     "emit": true,
     "sub_check": "IOS4-078.b",
     "hedge_codes": [
      "IOS4-079"
     ],
     "basis": "GOLD:G-TR-004",
     "reason": null,
     "value_templates": {
      "pd": "Конфигурация вентиляции по листу {pd_sheet} ПД",
      "rd": "Конфигурация вентиляции изменена",
      "id": null
     }
    },
    {
     "discrepancy_types": [
      "ELEMENT_ADDED",
      "UNDOCUMENTED_WORK"
     ],
     "comparison_result": "EXTRA_ELEMENT",
     "parameter_code": null,
     "parameter_mapping_status": null,
     "emit": false,
     "sub_check": null,
     "hedge_codes": [],
     "basis": "CONTEXT",
     "reason": "добавленные ветви — контекст (97 §2.10); перенумерация ветвей не является нарушением",
     "value_templates": null
    },
    {
     "discrepancy_types": [
      "POSITION_SHIFTED"
     ],
     "comparison_result": "CONFIGURATION_MISMATCH",
     "parameter_code": null,
     "parameter_mapping_status": null,
     "emit": false,
     "sub_check": null,
     "hedge_codes": [],
     "basis": "CONTEXT",
     "reason": "перенос без изменения состава по помещению — контекст (97 §2.10)",
     "value_templates": null
    }
   ]
  },
  {
   "family": "VENT_DUCT",
   "label_ru": "Воздуховоды общеобменной вентиляции (сечения)",
   "section": "ИОС4",
   "disciplines": [
    "ОВ"
   ],
   "topic": "VENTILATION",
   "tag_patterns": [],
   "anchors": [
    "воздуховод",
    "сечение воздуховода"
   ],
   "routes": [
    {
     "discrepancy_types": [
      "VALUE_DECREASED"
     ],
     "comparison_result": "VALUE_MISMATCH",
     "parameter_code": "IOS4-078",
     "parameter_mapping_status": "SOURCE_MATRIX",
     "emit": true,
     "sub_check": "IOS4-078.a",
     "hedge_codes": [
      "IOS4-079"
     ],
     "basis": "MATRIX",
     "reason": null,
     "value_templates": {
      "pd": "{pd_value}",
      "rd": "{rd_value}",
      "id": "{id_value}"
     }
    },
    {
     "discrepancy_types": [
      "VALUE_INCREASED"
     ],
     "comparison_result": "VALUE_MISMATCH",
     "parameter_code": "IOS4-078",
     "parameter_mapping_status": "SOURCE_MATRIX",
     "emit": false,
     "sub_check": null,
     "hedge_codes": [],
     "basis": "CONTEXT",
     "reason": "направленный триггер «уменьшение площади сечения»",
     "value_templates": null
    }
   ]
  },
  {
   "family": "SMOKE_CONTROL_FAN",
   "label_ru": "Вентиляторы дымоудаления и подпора воздуха",
   "section": "ППМ",
   "disciplines": [
    "ОВ",
    "ПБ"
   ],
   "topic": "FIRE",
   "tag_patterns": [
    "^(?:ДУ|ДВ|ПД|ВД|КД)\\d{1,2}$"
   ],
   "anchors": [
    "дымоудаление",
    "подпор воздуха",
    "противодымная вентиляция"
   ],
   "routes": [
    {
     "discrepancy_types": [
      "VALUE_DECREASED"
     ],
     "comparison_result": "VALUE_MISMATCH",
     "parameter_code": "PPM-112",
     "parameter_mapping_status": "SOURCE_MATRIX",
     "emit": true,
     "sub_check": null,
     "hedge_codes": [],
     "basis": "MATRIX",
     "reason": null,
     "value_templates": {
      "pd": "{pd_value}",
      "rd": "{rd_value}",
      "id": "{id_value}"
     }
    },
    {
     "discrepancy_types": [
      "ELEMENT_MISSING"
     ],
     "comparison_result": "MISSING_DESIGN_ELEMENT",
     "parameter_code": "PPM-112",
     "parameter_mapping_status": "PROVISIONAL_DOMAIN_MAPPING",